Perguntas,Alternativas,Resposta,Ano
"Plínio é denunciado pelo Ministério Público como incurso no artigo 121, do Código Penal (homicídio). Expedido mandado para citação pessoal, o Oficial de Justiça verifica que o réu Plínio se oculta para não ser citado, certificando nos autos. Neste caso,","a) o réu deverá ser citado por hora certa, de acordo com as normas preconizadas pelo Código de Processo Civil. | b) a citação do réu deverá ser feita via correio com aviso de recebimento. | c) o réu deverá ser citado por edital. | d) a citação do réu deverá ser feita na pessoa de um vizinho, familiar ou funcionário da empresa ou edifício onde reside. | e) o Oficial de Justiça deverá solicitar ao juiz a Força Policial para que o mandado citatório seja cumprido, com o uso da força necessária e moderada.",a,2012
"Considere: I. Juiz. II. Acusado. III. Advogado. IV. Perito. V. Testemunha. NÃO integram a relação processual, dentre outras, as pessoas indicadas APENAS em","a) I, II e III. | b) I, II e IV. | c) III, IV e V. | d) I e III. | e) IV e V.",c,2012
"Em um processo penal, a sentença condenatória foi proferida pelo juiz em audiência, com a presença do acusado e de seu defensor constituído. O prazo para o acusado recorrer começará a correr do dia",a) da intimação pessoal do acusado por Oficial de Justiça. b) da audiência. | c) da intimação pessoal do defensor do acusado por Oficial de Justiça. | d) seguinte à intimação do Ministério Público | e) seguinte ao decurso do prazo para recurso do Ministério Público.,b,2012
"Nos crimes de ação privada, o inquérito policial será iniciado",a) por requisição da autoridade judiciária. | b) mediante requerimento de quem tenha qualidade para intentá-la. | c) de ofício. d) mediante requerimento do Ministério Público. | e) mediante requerimento de qualquer pessoa do povo.,b,2012
"No procedimento comum ordinário, a acusação e a defesa poderão arrolar cada qual até",a) dez testemunhas. | b) três testemunhas. | c) oito testemunhas. | d) cinco testemunhas. | e) seis testemunhas.,c,2012
"No procedimento relativo às infrações de menor potencial ofensivo, a apelação","a) será julgada pelo Tribunal de Justiça. | b) deverá ser interposta no prazo de 05 (cinco)  dias. | c) não precisa vir acompanhada de razões, dispondo o recorrente de 08 (oito)  dias para apresentá-la, após o recebimento da inconformidade. | d) deverá ser interposta no prazo de 10 (dez)  dias, intimando- se a seguir o recorrido para oferecer resposta escrita no mesmo prazo. | e) será julgada independentemente de intimação das partes para a sessão de julgamento.",d,2012
"Atenção: As questões de números 76 a 80 referem-se a Consolidação
Normativa da Corregedoria Geral da Justiça
do Estado do Rio de Janeiro.Fernanda, funcionária pública do Tribunal de Justiça, recém empossada, está com dificuldades em efetuar a autuação e a formação dos autos dos processos. Seu superior hierárquico explicou que","a) os autos, em regra, não excederão 150 folhas em cada volume, sendo que, quando ultrapassar esta numeração, ocorrerá a abertura de novo volume que obedecerá a ordem cronológica. | b) o desentranhamento de peças dos autos induz a renumeração do processo, que deverá seguir a ordem cronológica. | c) o encerramento e a abertura de novo volume serão efetuados mediante lavratura dos respectivos termos, em folhas suplementares e sem remuneração, que retomará a sequência do volume encerrado. | d) na restauração de autos será usada obrigatoriamente a cor amarela na capa dos autos, independentemente da cor originária. | e) eventuais alterações de partes e seus advogados que ocorram no curso do processo deverão ser anotadas obrigatoriamente na contracapa dos autos, evitando-se rasuras na capa.",c,2012
"Atenção: As questões de números 81 a 86 referem-se ao Código
de Organização e Divisão Judiciárias do Estado
do Rio de Janeiro.Considere hipoteticamente que o Tribunal de Justiça pretende alterar o número de seus membros. Atendendo aos requisitos legais, a alteração do número de membros do referido Tribunal depende de proposta do","a) Corregedor Geral da Justiça, exclusivamente. | b) Conselho da Magistratura. | c) Presidente do Tribunal, exclusivamente. | d) Órgão Especial. | e) Presidente do Tribunal em conjunto com o Corregedor- Geral da Justiça.",d,2012
"Jamiltom, funcionário público civil do Poder Executivo do Estado do Rio de Janeiro, é reincidente em falta já punida com repreensão. Neste caso, de acordo com o Decreto- Lei no 220/75, no caso de reincidência em falta já punida com repreensão será aplicada a pena de",a) multa de até 50% dos vencimentos do servidor. | b) demissão. | c) repreensão escrita. | d) suspensão. | e) multa de até 50% do salário mínimo nacional vigente.,d,2012
"Em relação aos sujeitos processuais, é correto afirmar:","a) O prazo para o assistente recorrer supletivamente começa a correr imediatamente após o transcurso do prazo do Ministério Público. | b) O assistente será admitido enquanto não for proferida sentença de mérito na ação penal condenatória. | c) Desde que devidamente habilitado, o corréu no mesmo processo poderá intervir como assistente do Ministério Público. | d) Após o advento da Constituição da República de 1988, a queixa subsidiária deixou de ser admissível. | e) Nos casos a serem submetidos ao tribunal do júri, a assistência deverá ser requerida até 3 (três)  dias antes do julgamento para que possa o assistente participar do julgamento em Plenário.",a,2012
"No tocante à prova no processo penal, é INCORRETO afirmar que","a) é facultado ao juiz determinar, no curso da instrução, ou antes de proferir sentença, a realização de diligências para dirimir dúvida sobre ponto relevante. | b) o juiz formará sua convicção pela livre apreciação da prova produzida em contraditório judicial, não podendo fundamentar sua decisão exclusivamente nos elementos informativos colhidos na investigação, ressalvadas as provas cautelares, não repetíveis ou antecipadas. | c) o exame de corpo de delito realizado por perito oficial somente poderá ser feito durante o dia. | d) quando a infração deixar vestígios, será indispensável o exame de corpo de delito, direto ou indireto, não podendo supri-lo a confissão do acusado. | e) durante o curso do processo judicial, é permitido às partes, quanto à perícia, requerer a oitiva dos peritos para esclarecerem a prova ou para responderem a quesitos, desde que o mandado de intimação e os quesitos ou questões a serem esclarecidos sejam encaminhados com antecedência mínima de dez dias, podendo apresentar as respostas em laudo complementar.",c,2012
"De acordo com o Código de Processo Penal, a lei processual penal","a) retroage para invalidar os atos praticados sob a vigência da lei anterior, se mais benéfica. | b) não admite aplicação analógica. | c) admite suplemento dos princípios vitais de direito. | d) admite interpretação extensiva, mas não suplemento dos princípios gerais de direito. | e) admite aplicação analógica, mas não interpretação extensiva.",c,2012
"Hermes, réu primário, é processado e condenado pelo crime previsto no art. 33, caput, da Lei no 11.343/06 à pena de 5 (cinco) anos de reclusão, em regime fechado, por fato praticado em 21/11/2008 e, em outro processo, pelo crime do art. 157, § 2o , I do Código Penal, à pena de 6 (seis) anos de reclusão, em regime fechado, por fato praticado em 29/03/2007. O trânsito em julgado de ambas as condenações ocorreu em 20/04/2011. A família do preso procura a Defensoria Pública e informa que Hermes foi capturado em 22/04/2012 para início do cumprimento de pena e gostaria de informações acerca dos prazos para progressão de regime. Neste caso, a progressão de regime","a) ocorrerá após o cumprimento de 1/6 da pena unificada das duas condenações. | b) observará o prazo de 2/5 do cumprimento da pena do crime de tráfico de drogas e o cumprimento de 1/6 da pena do crime de roubo, adotando-se o cálculo diferenciado. | c) ocorrerá após o cumprimento de 2/5 da pena unificada das duas condenações. | d) observará o prazo de 1/3 do cumprimento da pena unificada. | e) observará o prazo de 1/6 do cumprimento da pena do crime de tráfico de drogas e o cumprimento de 2/5 da pena do crime de roubo, adotando-se o cálculo diferenciado.",b,2012
"Em uma ação penal privada, o juiz","a) não pode, em razão da natureza da ação, decretar a prisão preventiva do querelado. | b) só pode decretar a prisão preventiva do querelado se houver requerimento do Ministério Público. | c) pode decretar a prisão preventiva do querelado de ofício somente se houver representação da autoridade policial. | d) só pode decretar a prisão preventiva do querelado se houver requerimento do querelante. | e) pode decretar a prisão preventiva do querelado de ofício, mesmo se não houver requerimento do Ministério Público, do querelante ou de representação da autoridade policial.",e,2012
"A possibilidade jurídica do pedido, o interesse de agir e a legitimidade ad causam são:","a) pressupostos processuais. | b) condições da ação. | c) condição da ação, pressuposto processual e pressuposto processual, respectivamente. | d) pressuposto processual, pressuposto processual e condição da ação, respectivamente. | e) condição da ação, pressuposto processual e condição da ação, respectivamente.",b,2012
"A respeito do inquérito policial, considere: I. A Guarda Municipal pode instaurar e produzir inquéritos policiais. II. O Prefeito Municipal não pode requisitar a instauração de inquérito policial para apurar fato supostamente delituoso ocorrido no âmbito do município. III. O indiciado é obrigado a responder, no interrogatório, as perguntas da autoridade policial e somente em juízo pode valer-se do direito de permanecer calado. Está correto o que consta SOMENTE em",a) II e III. | b) I e II. | c) I e III. | d) II. | e) I.,d,2012
"O valor da fiança, medida cautelar substitutiva da prisão, quando se tratar de infração cuja pena privativa de liberdade, em grau máximo, for superior a quatro anos será fixado de","a) 10 a 200 salários mínimos e, se assim recomendar a situação econômica do preso, a fiança poderá ser dispensada, nos termos da lei, reduzida até o máximo de 1/2 (metade)  ou aumentada em até 2000 vezes. | b) 1 a 100 salários mínimos e, se assim recomendar a situação econômica do preso, a fiança poderá ser dispensada, nos termos da lei, reduzida até o máximo de 1/2 (metade)  ou aumentada em até 2000 vezes. | c) 10 a 200 salários mínimos e, se assim recomendar a situação econômica do preso, a fiança poderá ser dispensada, nos termos da lei, reduzida até o máximo de 2/3 ou aumentada em até 1000 vezes. | d) 1 a 100 salários mínimos e, se assim recomendar a situação econômica do preso, a fiança poderá ser dispensada, nos termos da lei, reduzida até o máximo de 2/3 ou aumentada em até 1000 vezes. | e) 1 a 100 salários mínimos e, se assim recomendar a situação econômica do preso, a fiança poderá ser dispensada, nos termos da lei, reduzida até o máximo de 1/3 ou aumentada em até 500 vezes.",c,2012
"José, primário, de bons antecedentes e regularmente identificado, está sendo investigado em regular inquérito policial, acusado de praticar crime de contrabando na forma simples, punido com reclusão de um a quatro anos. Nesse caso,","a) o Juiz poderá aplicar de ofício a José, durante a fase investigatória, uma das medidas cautelares substitutivas da prisão preventiva, desde que presentes os pressupostos legais para tanto. | b) o Juiz poderá decretar, de ofício, durante a fase investigatória, presentes os requisitos legais, a prisão preventiva de José. | c) havendo prisão em flagrante e tratando-se de crime inafiançável, o juiz poderá conceder a José liberdade provisória. | d) havendo prisão em flagrante, a Autoridade Policial não poderá arbitrar a fiança ao réu, cabendo exclusivamente ao Magistrado fixá-la. | e) o Juiz, em regra, não poderá decretar a prisão preventiva de José.",e,2012
"Sobre o habeas corpus e seu processo, de acordo com o Código de Processo Penal, considere: I. A competência para processar e julgar, originalmente, o habeas corpus, cuja autoridade coatora for um Secretário de Estado, é do Tribunal de Justiça do respectivo Estado. II. A utilização do habeas corpus é assegurada ao agente que responde processo por infração penal, a que a pena pecuniária seja a única cominada ou contra decisão condenatória a pena de multa. III. José, Juiz de Direito de uma determinada comarca do Estado de São Paulo, recebeu, após regular distribuição, um habeas corpus questionando uma ordem dada por um Delegado de Polícia da cidade. Após requisitar informações, tomou conhecimento de que a ordem foi ratificada por Pedro, outro Juiz de Direito da mesma comarca, para o qual o Inquérito Policial foi distribuído. Neste caso, cessa de imediato a competência do Magistrado José, para quem foi distribuído o habeas corpus, conhecer do writ. Está correto o que consta APENAS em",a) I. | b) III. | c) I e II. | d) I e III. | e) II e III.,d,2012
Na dinâmica do inquérito policial NÃO se inclui,"a) o reconhecimento de pessoas e coisas. | b) as acareações. | c) o pedido de prisão temporária. | d) a apreensão dos objetos que tiverem relação com o fato, após liberados pelos peritos criminais. | e) a apresentação, através de advogado, de defesa preliminar por parte do indiciado.",e,2012
"Em relação ao juizado especial, é INCORRETO afirmar:","a) Os atos processuais poderão ser realizados em qualquer dia da semana, conforme dispuserem as normas de organização judiciária. | b) Serão objeto de registro escrito exclusivamente os atos havidos por essenciais. | c) A prática de atos processuais em outras comarcas poderá ser solicitada por qualquer meio hábil de comunicação. | d) A intimação à firma individual, se necessário, poderá ser feita por oficial de justiça, independentemente de mandado. | e) A intimação será feita por correspondência, sem necessidade de aviso de recebimento pessoal.",e,2012
"No Juizado Especial Criminal,","a) a intimação de pessoa jurídica poderá ser feita mediante entrega de correspondência ao encarregado da recepção, que será obrigatoriamente identificado. | b) a competência será determinada pelo domicílio ou residência do réu. | c) não encontrado o acusado para citação pessoal, não se desloca a competência para o juízo comum. | d) os atos processuais são públicos e podem realizar- se em qualquer dia da semana, no horário diurno. | e) a declaração de nulidade do ato independe da comprovação de prejuízo.",a,2012
O juiz dar-se-á por suspeito se,"a) tiver funcionado seu cônjuge ou parente, consanguíneo ou afim, em linha reta ou colateral até o terceiro grau, inclusive, como defensor ou advogado, órgão do Ministério Público, autoridade policial, auxiliar da justiça ou perito. | b) ele próprio houver desempenhado qualquer dessas funções ou servido como testemunha. | c) tiver funcionado como juiz de outra instância, pronunciando-se, de fato ou de direito, sobre a questão. | d) ele próprio ou seu cônjuge ou parente, consanguíneo ou afim em linha reta ou colateral até o terceiro grau, inclusive, for parte ou diretamente interessado no feito. | e) ele, seu cônjuge, ascendente ou descendente, estiver respondendo a processo por fato análogo, sobre cujo caráter criminoso haja controvérsia.",e,2012
"Ticio está cometendo a infração penal; Tércio acabou de cometê-la; Cícero foi encontrado, logo depois, com instrumentos, armas e objetos que fazem presumir ser ele o autor da infração; Augusto foi localizado alguns dias depois do delito, em razão de investigações da polícia que o indicavam como seu autor. Podem ser presos em flagrante:","a) somente Cícero e Augusto. | b) somente Tício e Tércio. | c) somente Cícero e Tércio. | d) somente Tício, Tércio e Cícero. | e) Tício, Tércio, Cícero e Augusto.",d,2012
"Compete aos Tribunais Regionais Federais processar e julgar originariamente, ressalvada a competência da Justiça Eleitoral, os habeas corpus, quando",a) o paciente for o Procurador-Geral da República. | b) o paciente for Desembargador do Distrito Federal. | c) a autoridade coatora for Comandante da Marinha. | d) a autoridade coatora for juiz federal. | e) a autoridade coatora for Ministro de Estado.,d,2012
O juiz poderá exercer a jurisdição no processo em que seu cônjuge tiver funcionado como,a) perito. | b) advogado. | c) autoridade policial. | d) auxiliar da justiça. | e) testemunha.,e,2012
Para responder às questões de números 25 a 30 assinale a alternativa correta em relação ao assunto indicado. Recursos e ações de impugnação.,"a) O efeito devolutivo em extensão, em apelação criminal, impede que o Tribunal de Justiça conheça pedido diverso do constante no recurso. | b) Poderá o Ministro Relator, em analogia à lei processual civil, conceder, de forma monocrática, a ordem pleiteada no habeas corpus impetrado em desfavor de decisão contrária à súmula ou jurisprudência dominante de Tribunal Superior. | c) Conhecido o recurso especial interposto em face de sentença penal condenatória confirmada pelo Tribunal de Justiça, é possível a expedição de mandado de prisão para o cumprimento da decisão de segundo grau em razão da ausência de efeito suspensivo no recurso especial. | d) Interposta apelação criminal por defensor público em face de decisão que condenou o acusado à pena de multa, a juntada superveniente do termo de renúncia do acusado ao direito de apelação impede o conhecimento da apelação criminal. | e) O pleito de reexame probatório não constitui fundamentação idônea para o ajuizamento de revisão criminal.",b,2012
Para responder às questões de números 25 a 30 assinale a alternativa correta em relação ao assunto indicado. Princípios e garantias processuais penais fundamentais.,"a) O princípio do nemo tenetur se detegere é corolário da garantia constitucional do direito ao silêncio e impede que todo o acusado seja compelido a produzir ou contribuir com a formação de prova contrária ao seu interesse, salvo se não houver outro meio de produção de prova. | b) Constitui nulidade relativa o desempenho de uma única defesa técnica para corréus em posições conflitantes, em razão de violação ao princípio da ampla defesa. | c) A garantia constitucional da duração razoável do processo não se aplica ao inquérito policial por este tratar de procedimento administrativo, sendo garantia exclusiva do processo acusatório. | d) O Superior Tribunal de Justiça vem admitindo a mitigação do princípio da identidade física do juiz nos casos de convocação, licença, promoção ou de outro motivo que impeça o juiz que tiver presidido a instrução de sentenciar o feito, aplicando, por analogia, a lei processual civil. | e) A defesa técnica em processo penal, por ser garantia exclusiva do acusado, pode ser por ele renunciada, desde que haja expressa manifestação de vontade homologada pelo juiz competente.",d,2012
"Em relação às testemunhas, é correto afirmar que","a) as pessoas impossibilitadas por enfermidade ou velhice serão dispensadas de depor. | b) será permitida à testemunha breve consulta a apontamentos. | c) as pessoas com dever de sigilo são proibidas de depor mesmo se desobrigadas pela parte interessada. | d) as perguntas serão formuladas pelas partes diretamente à testemunha, exceto se não tiverem relação com a causa. | e) se o juiz reconhecer que alguma testemunha fez afirmação falsa, remeterá cópia do depoimento para o Ministério Público, para instauração de inquérito.",b,2012
A competência para processar e julgar originariamente membro dos Conselhos ou Tribunais de Contas dos Municípios nos crimes comuns e de responsabilidade pertence,a) ao Supremo Tribunal Federal. | b) ao Tribunal Regional Federal. | c) ao Tribunal de Justiça Estadual. | d) ao Superior Tribunal de Justiça. | e) à Justiça Estadual de 1º grau.,d,2012
Caberá ação penal privada subsidiária nos crimes de ação penal pública quando,a) o Ministério Público requerer o arquivamento do inquérito policial e o juiz o denegar. | b) o Procurador-Geral insistir no pedido de arquivamento de inquérito policial. | c) houver legitimidade ativa concorrente entre o Ministério Público e o ofendido em crime de ação penal pública condicionada à representação. | d) o ofendido for pessoa jurídica de direito privado. | e) a ação penal não for intentada no prazo legal.,e,2012
"Sobre a competência processual pela prerrogativa de função,","a) é definida aos Tribunais relativamente às pessoas que devam responder perante eles por crimes comuns e de responsabilidade. | b) é definida pelo Código de Processo Penal exclusivamente às hipóteses de julgamento pelo Supremo Tribunal Federal. | c) não é deferida em nenhuma hipótese aos Tribunais Regionais Federais. | d) a ação de improbidade, de que trata a Lei nº 8.429/1992, será proposta perante o tribunal competente para processar e julgar criminalmente o funcionário ou autoridade. | e) tem prevalência ainda que o inquérito policial ou a ação judicial sejam iniciados após a cessação do exercício da função pública.",a,2012
"Presentes os demais pressupostos legais caberá prisão temporária quando houver fundadas razões, de acordo com qualquer prova admitida na legislação penal, de autoria ou participação do indiciado, dentre outros, no crime de",a) explosão. | b) incêndio. | c) extorsão. | d) aborto. | e) concussão.,c,2011
Sobre a sentença é correto afirmar que:,"a) O juiz, ao proferir a sentença condenatória, não poderá fixar em favor do ofendido valor mínimo para reparação dos danos causados pela infração, devendo a discussão ser dirimida no juízo cível. | b) Qualquer das partes poderá, no prazo de cinco dias, pedir ao juiz que declare a sentença, sempre que nela houver obscuridade, ambiguidade, contradição ou omissão. | c) O juiz, sem modificar a descrição do fato contida na denúncia ou queixa, poderá atribuir-lhe definição jurídica diversa, desde que, em consequência, não tenha de aplicar pena mais grave. | d) Nos crimes de ação pública, o juiz poderá proferir sentença condenatória, ainda que o Ministério Público tenha opinado pela absolvição, bem como reconhecer agravantes, embora nenhuma tenha sido alegada. | e)  Havendo aditamento da denúncia, cada parte poderá arrolar até cinco testemunhas, no prazo de 5 (cinco)  dias, ficando o juiz, na sentença, adstrito aos termos do aditamento.",d,2011
"Considere as seguintes assertivas sobre as espécies de ação penal, de acordo com o Código de Processo Penal: I. Na ação penal privada, comparecendo mais de uma pessoa com direito de queixa, terá preferência o descendente e, em seguida, pela ordem, o cônguge e o ascendente, podendo, entretanto, qualquer delas prosseguir na ação, caso o querelante desista da instância ou a abandone. II. Seja qual for o crime, quando praticado em detrimento do patrimônio ou interesse da União, a ação penal será pública. III. Na ação penal pública condicionada, o direito de representação poderá ser exercido, pessoalmente ou por procurador com poderes especiais, mediante declaração, escrita ou oral, feita ao juiz, ao órgão do Ministério Público, ou à autoridade policial. Está correto o que se afirma SOMENTE em",a) I e II. | b) II. | c) I. | d) II e III. | e) I e III.,d,2011
"Sobre o mandado de segurança, o habeas corpus e o Juizado Especial Criminal, correlatamente, pode-se afirmar que","a) compete à turma recursal, e não ao Tribunal de Justiça, processar e julgar o mandado de segurança contra ato de Juizado Especial. | b) embora caiba o mandado de segurança, por se tratar de medidas sancionadoras sem previsão de restrição à liberdade de locomoção não cabe o habeas corpus no âmbito do Juizado Especial Criminal. | c) o Promotor de Justiça é parte ilegítima para impetrar mandado de segurança contra ato jurisdicional no Juizado Especial Criminal. | d) não cabe recurso de habeas corpus aos Tribunais Superiores em temas afetos aos Juizados Especiais Criminais. | e) não cabe mandado de segurança em matéria de crimes de menor potencial ofensivo.",a,2011
"No caso de descumprimento de qualquer das obrigações impostas ao se fixar medida cautelar diversa da prisão, o juiz,","a) depois de ouvir o infrator, deverá decretar a prisão preventiva. | b) mediante requerimento do Ministério Público, poderá substituir a medida, impor outra em cumulação, dobrar o valor da fiança, cabendo apenas decretar a prisão preventiva em caso de crime doloso cometido por reincidente. | c) de ofício ou mediante requerimento do Ministério Público, de seu assistente ou do querelante, poderá substituir a medida, impor outra em cumulação, ou, em último caso, decretar a prisão preventiva. | d) apenas mediante requerimento do Ministério Público poderá substituir a medida, impor outra em cumulação, ou, em último caso, decretar a prisão preventiva. | e) de ofício ou mediante requerimento do Ministério Público, poderá substituir a medida, impor outra em cumulação, decretar a prisão temporária por até 60 dias ou, em último caso, decretar a prisão preventiva até o término da instrução criminal.",c,2011
