Perguntas,Alternativas,Resposta,Ano
"A fiança, instituto classicamente atrelado pela doutrina à liberdade provisória, está atualmente regulada pelo Código de Processo Penal do artigo 321 ao 350, e, segundo a doutrina, consiste em uma caução, uma garantia real, prestada geralmente em dinheiro, que tem como objetivos principais a colocação do indiciado ou do acusado em liberdade e, ainda, em vincular o afiançado ao processo, obrigando-o ao comparecimento em seus atos. Diante de tais considerações,","a) depois de prestada a fiança, que será concedida independentemente de audiência do Ministério Público, este terá vista do processo a fim de requerer o que julgar conveniente. | b) é possível a concessão de fiança ainda quando presentes os motivos que autorizam a decretação da prisão preventiva. | c) é possível a concessão de fiança no crime de tráfico ilícito de entorpecentes e drogas afins. | d) a autoridade policial somente poderá conceder fiança nos casos de infração cuja pena privativa de liberdade máxima não seja superior a 2 anos. | e) é possível a concessão de fiança em caso de prisão civil.",a,2018
"O Código de Processo Penal, bem como o entendimento sumulado do Supremo Tribunal Federal e do Superior Tribunal de Justiça, acerca do Inquérito Policial, dispõe:","a) Arquivado o inquérito policial, por despacho do juiz, a requerimento do promotor de justiça, é possível a ação penal ser reiniciada, ainda que sem novas provas, desde que não prescrito o crime. | b) É direito do defensor, no interesse do representado, ter acesso amplo aos elementos de prova que, já documentados em procedimento investigatório realizado por órgão com competência de polícia judiciária, digam respeito ao exercício do direito de defesa. | c) Para verificar a possibilidade de a infração ter sido praticada de determinado modo, a autoridade policial poderá proceder à reprodução simulada dos fatos, ainda que esta contrarie a moralidade ou a ordem pública, tendo em vista o princípio da obrigatoriedade. | d) O ofendido, ou seu representante legal, e o indiciado não possuem legitimidade para requerer diligências para a autoridade policial, tendo em vista o princípio da oficialidade. | e) Nos crimes de ação privada, a autoridade policial poderá proceder a inquérito, ainda que não haja requerimento de quem tenha qualidade para intentá-la, uma vez que tal exigência somente é necessária para a proposição da ação penal.",b,2018
"Segundo o que dispõe a legislação, bem como o entendimento sumulado do Supremo Tribunal Federal e do Superior Tribunal de Justiça acerca dos recursos no Processo Penal brasileiro, é correto afirmar:","a) É possível que o tribunal reconheça, de ofício, eventual nulidade em prejuízo do réu, mesmo que ela não tenha sido arguida no recurso interposto pela acusação. | b) A renúncia do réu ao direito de apelação, manifestada sem a assistência do defensor, impede o conhecimento da apelação por este interposta. | c) É possível, por razões de conveniência e oportunidade, o Ministério Público desistir de recurso que haja interposto. | d) O recurso será interposto por petição ou por termo nos autos, assinado pelo recorrente ou por seu representante. | e) No caso de concurso de agentes, a decisão do recurso interposto por um dos réus, ainda que fundado em motivos de caráter exclusivamente pessoal, aproveitará aos demais.",d,2018
"Em decorrência do princípio da ampla defesa, bem como do devido processo legal, previstos, inclusive, pela Constituição Federal, é imprescindível que os acusados sejam cientificados da existência do processo e de seu desenvolvimento. Sobre as citações e intimações, o Código de Processo Penal dispõe:","a) A citação inicial far-se-á pelo correio, quando o réu estiver no território sujeito à jurisdição do juiz que a houver ordenado. | b) Quando o réu estiver fora do território da jurisdição do juiz processante, será citado mediante carta de ordem. | c) A citação por hora certa não é prevista no processo penal. | d) As citações que houverem de ser feitas em legações estrangeiras (embaixadas e consulados)  serão efetuadas mediante carta precatória. | e) O dia designado para funcionário público comparecer em juízo, como acusado, será notificado assim a ele como ao chefe de sua repartição.",e,2018
"Estabelece a Lei de Execução Penal que, durante a execução da pena, sobrevindo doença mental no condenado,",a) poderá ter a pena diminuída de 1/3 a 2/3. | b) terá a sua pena substituída por medida de segurança. | c) será internado em Hospital de Custódia e Tratamento Psiquiátrico. | d) terá o restante da pena remida e deverá submeter-se a tratamento psiquiátrico ambulatorial. | e) deverá ser submetido a perícia médico-legal para apurar a sua periculosidade.,c,2017
"Segundo a Lei de Execução Penal, o preso, condenado com trânsito em julgado, poderá ter a execução da sua pena fiscalizada por meio da monitoração eletrônica, quando o juiz","a) fixar o regime aberto para cumprimento da pena e o dispensar do recolhimento ao estabelecimento penal no período noturno e nos dias de folga. | b) aplicar pena restritiva de liberdade a ser cumprida nos regimes aberto ou semiaberto, ou conceder progressão para tais regimes. | c) aplicar pena restritiva de direitos que estabeleça limitação de horários ou de frequência a determinados lugares. | d) conceder o livramento condicional ou a suspensão condicional da pena. | e) autorizar a saída temporária no regime semiaberto ou determinar a prisão domiciliar.",e,2017
"A Lei nº 11.343/2006 – Lei de Drogas, estabelece em seu art. 59 – Nos crimes previstos nos arts. 33, caput e § 1º , e 34 a 37 desta Lei, o réu não poderá apelar sem recolher-se à prisão, salvo se for primário e de bons antecedentes, assim reconhecido na sentença condenatória.Este dispositivo legal","a) foi declarado inconstitucional pelo Supremo Tribunal Federal. | b) estabeleceu modalidade de prisão preventiva visando a garantia da ordem pública e assegurar a aplicação da lei penal. | c) é incompatível com a regra do Código de Processo Penal que determina que o juiz, ao proferir a sentença condenatória, decidirá, fundamentadamente, sobre a manutenção ou a imposição de prisão preventiva. | d) somente poderá ser aplicado no caso de sentença penal condenatória que impuser o regime inicial de cumprimento da pena fechado. | e) é modalidade de execução provisória da pena privativa de liberdade aplicada ao réu.",c,2017
O exame de corpo de delito,"a) é dispensável nos crimes que deixam vestígios. | b) deve ser feito imediatamente para que não se percam os vestígios do crime, o que veda a indicação de assistente técnico pelas partes. | c) deve ser feito, em regra, pelo menos 2 horas após o óbito. | d) realiza-se sobre vestígios do corpo humano, havendo regime diverso para o exame sobre objetos e sobre reconhecimento de escritos. | e) pode ser rejeitado pelo juiz, no todo ou em parte.",e,2017
"No âmbito do inquérito policial, incumbe à autoridade policial",a) arquivar o inquérito policial. | b) assegurar o sigilo necessário à elucidação do fato. | c) decretar a prisão preventiva. | d) presidir a audiência de custódia. | e) oferecer a denúncia.,b,2017
"O Código de Processo Penal dispõe que qualquer do povo poderá e as autoridades policiais e seus agentes deverão prender quem quer que seja encontrado em flagrante delito. Diante de tal contexto, é correto afirmar:","a) Em até 48 horas após a realização da prisão, será encaminhado ao juiz competente o auto de prisão em flagrante e, caso o autuado não informe o nome de seu advogado, cópia integral para a Defensoria Pública. | b) A prisão em flagrante deve ser relaxada quando a autoridade policial a considerar, fundamentadamente, ilegal. | c) Se a autoridade policial verificar que o agente praticou o fato acobertado por alguma excludente de ilicitude, poderá, fundamentadamente, conceder ao acusado liberdade provisória, mediante termo de comparecimento a todos os atos processuais, sob pena de revogação. | d) Apresentado o preso à autoridade competente, ouvirá esta o condutor e colherá, desde logo, sua assinatura, entregando a este cópia do termo e recibo de entrega do preso. Em seguida, procederá à oitiva das testemunhas que o acompanharem e ao interrogatório do acusado sobre a imputação que lhe é feita, colhendo, após cada oitiva suas respectivas assinaturas, lavrando, a autoridade, afinal, o auto. | e) Considera-se em flagrante delito quem é surpreendido na fase dos atos preparatórios da infração penal.",d,2017
"Irany, que trabalha como motorista de táxi, cumpre pena em regime aberto. Neste caso,","a) os horários do trabalho de Irany não precisam ser levados em consideração na fixação das condições do regime. | b) o exercício do trabalho lícito, devidamente comprovado, garante a Irany o direito à remição, ainda que seja como trabalhadora autônoma. | c) há hipóteses legais em que Irany pode ser dispensada da comprovação do exercício do trabalho. | d) pode ser-lhe imposta como condição especial a prestação de serviço comunitário. | e) cumprindo pena na modalidade domiciliar, Irany não depende de autorização judicial para se ausentar da cidade onde reside.",c,2017
"Taís foi condenada à pena de cinco anos e quatro meses de reclusão, em regime inicial semiaberto, pela prática de roubo majorado, tendo progredido ao regime aberto. No curso da execução, porém, foi novamente presa em flagrante pela prática, em tese, do crime de furto simples. Em razão disso, foi regredida ao regime fechado, sendo determinada, ainda, a alteração da data-base para o reconhecimento do direito à progressão de regime e do direito ao livramento condicional.Considerando o caso concreto e o entendimento jurisprudencial predominante, é","a) lícito o julgamento procedente do incidente disciplinar de falta grave sem prévia oitiva do sentenciado se a falta grave consistir na suspeita da prática de novo crime, já com denúncia recebida pelo juízo criminal. | b) lícita a alteração da data-base para o cálculo do livramento condicional e da progressão de regime se julgado procedente o incidente disciplinar de falta grave. | c) ilícita a alteração da data-base para o cálculo do livramento condicional, mesmo que reconhecida a prática de falta grave. | d) ilícita a alteração da data-base para o cálculo da progressão de regime quando a falta grave corresponde à suspeita da prática de novo crime. | e) ilícita a regressão cautelar de regime sem a realização de audiência de justificativa.",c,2017
"Em relação à insanidade mental do acusado,","a) o rito de insanidade mental será processado nos autos principais. | b) o juiz nomeará curador ao acusado, quando determinar o exame, sem estabelecer a suspensão do processo, se já iniciada a ação penal. | c) o exame não poderá ser ordenado na fase do inquérito policial. | d) a suspensão processual continua até que o acusado se restabeleça, se a doença mental sobrevier à infração. | e) o exame não durará mais de trinta dias, salvo se os peritos demonstrarem a necessidade de maior prazo.",d,2017
"Sobre a competência no processo penal, é correto afirmar:","a) Será determinada, de regra, pelo lugar do primeiro ato de execução criminosa. | b) O direito brasileiro desconhece a figura da competência pelo domicílio ou residência do réu, pois regula-se pelo lugar do crime. | c) A competência será determinada pela continência quando duas pessoas forem acusadas pelo mesmo crime. | d) Apenas os crimes dolosos contra a vida podem ser julgados pelo Tribunal do Júri. | e) Se na mesma circunscrição judiciária houver mais de um juiz igualmente competente para determinado crime, prevalece o critério da antiguidade na carreira.",c,2017
"Manoel está cumprindo pena em penitenciária paulista de segurança máxima, na cidade de Presidente Bernardes, após ser
condenado por quatro crimes de homicídio. Na cidade e comarca de São Paulo é instaurada uma nova ação penal contra
Manoel por crime de coação no curso do processo. Havendo fundada suspeita de que o réu, Manoel, integra organização
criminosa e que poderá fugir durante o deslocamento entre as cidades de Presidente Bernardes e São Paulo, o Magistrado
competente, por decisão fundamentada, e em caráter excepcional, assegurando ao réu a entrevista prévia com seu advogado e
o acompanhamento da audiência una de instrução, poderá,","a) de ofício, ou, a requerimento das partes, realizar o interrogatório de Manoel por sistema de videoconferência, intimando as partes com, pelo menos, 10 dias de antecedência. | b) se houver requerimento das partes, apenas, realizar o interrogatório de Manoel por sistema de videoconferência, intimando as partes com, pelo menos, 10 dias de antecedência. | c) de ofício, ou, a requerimento das partes, realizar o interrogatório de Manoel por sistema de videoconferência, intimando as partes com, pelo menos, 5 dias de antecedência. | d) se houver requerimento das partes, apenas, realizar o interrogatório de Manoel por sistema de videoconferência, intimando as partes com, pelo menos, 5 dias de antecedência. | e) de ofício, ou, a requerimento das partes, realizar o interrogatório de Manoel por sistema de videoconferência, intimando as partes com, pelo menos, 7 dias de antecedência.",a,2017
"No instituto da representação,","a) a renúncia à representação é vedada no âmbito no Juizado de Violência Doméstica e Familiar contra a Mulher. | b) a autoridade policial tem autonomia para instaurar inquérito policial mesmo na ausência de representação da vítima, nos crimes em que a ação pública dela depender. | c) a representação tem caráter personalíssimo, de modo que a morte do ofendido implica na imediata extinção da punibilidade do autor do fato criminoso. | d) o direito de representação poderá ser exercido, pessoalmente ou por procurador com poderes especiais, mediante declaração à autoridade policial. | e) a retratação da representação pode ser feita a qualquer tempo, dado o caráter disponível do direito envolvido.",d,2017
"Em relação ao chamado tráfico privilegiado, previsto no artigo 33, § 4°, da Lei nº 11.343/2006, considerando-se também o entendimento dos Tribunais Superiores, é correto afirmar que",a) não admite a conversão da pena privativa de liberdade em restritiva de direitos. | b) não admite suspensão condicional do processo. | c) admite transação penal. | d) não admite fiança. | e) exige cumprimento da pena em regime inicial fechado.,b,2017
"Sobre os Juizados Especiais Criminais, é correto afirmar que","a) é possível a composição civil dos danos em audiência preliminar, que acarreta a renúncia ao direito de queixa. | b) a transação penal independe de apreciação judicial. | c) da decisão que rejeitar a denúncia caberá recurso em sentido estrito. | d) nas infrações de menor potencial ofensivo o inquérito policial deve ser concluído em 20 dias. | e) têm competência para julgamento das infrações penais de menor potencial ofensivo, entendidas como os crime cuja pena mínima seja igual ou inferior a 1 ano.",a,2017
"A sentença penal condenatória foi proferida por juiz de direito que, posteriormente, foi promovido ao Tribunal de Justiça e, como desembargador, não pode participar do julgamento da apelação interposta pelo condenado. A razão processual de tal vedação é:","a) Suspeição, em razão de foro íntimo. | b) Suspeição, por haver julgado a causa em outra instância. | c) Impedimento, por haver julgado a causa em outra instância. | d) Incompetência, por haver julgado a causa em outra instância. | e) Perda de imparcialidade por haver julgado a causa em outra instância, mas não havia vedação processual para participar do julgamento.",c,2017
"Nas ações penais de competência originária do Supremo Tribunal Federal, estabelece a Lei nº 8.038/90:Art. 7º - Recebida a denúncia ou a queixa, o relator designará dia e hora para o interrogatório, mandando citar o acusado ou querelado e intimar o órgão do Ministério Público, bem como o querelante ou o assistente, se for o caso.No que tange ao interrogatório do acusado,","a) deve ser o ato derradeiro da instrução penal, nos termos do art. 400, do Código de Processo Penal, exceto quanto às ações penais onde o interrogatório tenha ocorrido antes da reforma de 2008. | b) será sempre o ato derradeiro da instrução penal, nos termos do art. 400, do Código de Processo Penal, pois mais favorável à defesa do acusado. | c) prevalecerá a regra procedimental da Lei nº 8.038/90 (art. 7º) , em detrimento da regra geral e subsidiária do Código de Processo Penal. | d) é irrelevante a ordem da realização do interrogatório, pois o acusado não está obrigado a responder às indagações do relator. | e) o Plenário do Supremo Tribunal Federal não tem posição pacífica sobre o tema, prevalecendo ora a regra da Lei nº 8.038/90, ora a regra do art. 400, do Código de Processo Penal.",a,2017
Da decisão que indeferir prisão preventiva caberá,a) correição parcial. | b) carta testemunhável. | c) agravo em execução. | d) habeas corpus. | e) recurso em sentido estrito.,e,2017
O recurso cabível da decisão que indeferir o pedido de restituição de coisa apreendida é,a) Mandado de Segurança. | b) recurso em sentido estrito. | c) correição parcial. | d) agravo em execução. | e) apelação.,e,2017
"Considerando a Lei de Execução Penal e a jurisprudência dos tribunais superiores sobre a remição, é correto afirmar:",a) O trabalho do preso cautelar não pode ser computado para fins de remição. | b) É impossível a cumulação da remição por estudo e por trabalho. | c) O trabalho intramuros é o único passível de remição. | d) Não há previsão legal de remição para o sentenciado em regime aberto. | e) O aproveitamento escolar insatisfatório não impede a remição por estudo.,e,2017
"O exame médico-legal, determinado pelo juiz para esclarecer dúvida sobre a integridade mental do autor do crime, poderá ser realizado",a) somente na fase da ação penal. | b) ainda na fase do inquérito policial. | c) apenas em casos excepcionais e quando houver requerimento do Ministério Público ou da defesa. | d) enquanto não transitar em julgado a sentença. | e) tão somente em manicômio judiciário.,b,2017
O lapso temporal para progressão de regime em caso de crime não hediondo praticado por reincidente é de,a) 2/5 da pena. | b) 3/5 da pena. | c) 2/3 da pena. | d) 1/6 da pena. | e) 1/2 da pena.,d,2017
"Em relação às citações e intimações disciplinadas no Código de Processo Penal, e, ainda, considerando o que dispõem as Súmulas do Supremo Tribunal Federal e Superior Tribunal de Justiça acerca do tema, é correto afirmar:","a) Intimada a defesa da expedição da carta precatória, torna-se desnecessária intimação da data da audiência no juízo deprecado. | b) Se o réu estiver preso, desnecessária sua citação, bastando a requisição ao diretor do estabelecimento prisional para sua apresentação em juízo, em dia e hora previamente marcados. | c) Se o réu não for encontrado, será citado por edital, com prazo de 10 dias. | d) Se o acusado, citado por edital, não comparecer, nem constituir advogado, ficarão suspensos o processo e o curso do prazo prescricional, sendo vedado ao juiz determinar a produção antecipada de provas, ainda que urgentes, em razão do princípio do contraditório. | e) É absoluta a nulidade do processo criminal por falta de intimação da expedição de precatória para inquirição de testemunha.",a,2017
O Código de Processo Penal dispõe que no regime da prisão preventiva,a) é vedada a decretação da prisão preventiva antes do início do processo criminal. | b) a decretação da prisão preventiva como garantia da ordem pública requer indício suficiente da existência do crime. | c) a prisão preventiva decretada por conveniência da instrução criminal ou para assegurar a aplicação da lei penal possuem relação de cautelaridade com o processo penal. | d) a reincidência é irrelevante para a admissão da prisão preventiva. | e) a gravidade do delito dispensa a motivação da decisão que decreta a prisão preventiva.,c,2017
Os princípios constitucionais aplicáveis ao processo penal incluem,a) indisponibilidade. | b) verdade real. | c) razoável duração do processo. | d) identidade física do juiz. | e) favor rei.,c,2017
NÃO constitui medida protetiva de urgência prevista na Lei nº 11.340/2006 − Lei Maria da Penha,"a) a prestação de alimentos provisórios. | b) a proibição de contato com a ofendida. | c) o afastamento dos familiares da ofendida, com fixação de limite mínimo de distância. | d) a suspensão de visitas aos dependentes menores. | e) o afastamento de cargo ou função pública.",e,2017
"De acordo com entendimento dos Tribunais Superiores,","a) é cabível habeas corpus originário para o Tribunal Pleno da decisão de Turma, ou do Plenário do Supremo Tribunal Federal, proferida em habeas corpus ou no respectivo recurso. | b) é cabível habeas corpus contra decisão condenatória a pena de multa. | c) são incabíveis habeas corpus e revisão criminal quando já extinta a pena privativa de liberdade. | d) é incabível habeas corpus relativo a processo em curso por infração penal a que a pena pecuniária seja a única cominada. | e) compete originariamente ao Superior Tribunal de Justiça o julgamento de habeas corpus contra decisão de turma recursal de juizados especiais criminais.",d,2017
"O regime da fiança no Código de Processo Penal, dispõe que","a) o descumprimento de medida cautelar diversa da prisão aplicada cumulativamente com a fiança pode gerar o quebramento da fiança. | b) é vedada a aplicação da fiança em crimes cometidos com violência ou grave ameaça contra a pessoa. | c) a situação econômica da pessoa presa é irrelevante para a fixação do valor da fiança, que deve ter relação com a gravidade do crime e os antecedentes criminais. | d) a fiança será prestada em dinheiro, sendo vedada a prestação por meio de pedras preciosas. | e) a concessão de fiança é ato exclusivo da autoridade judicial, visto que implica em decisão sobre a liberdade da pessoa.",a,2017
"Surgindo no curso do processo questão prejudicial sobre a existência do crime, o juiz criminal deixa de suspender a ação penal, apesar do requerimento expresso da defesa do acusado. Contra o despacho denegatório da suspensão",a) caberá reclamação. | b) caberá agravo de instrumento. | c) caberá apelação. | d) não caberá recurso. | e) caberá recurso especial.,d,2017
"Nos termos preconizados pelas Leis n 9.099/1995 e n 10.259/2001, que regulam os Juizados Especiais Criminais, considere:
I. A homologação da transação penal prevista no artigo 76 da Lei n 9.099/1995 não faz coisa julgada material e, descumpridas
suas cláusulas, retoma-se a situação anterior, possibilitando-se ao Ministério Público a continuidade da persecução
penal mediante oferecimento de denúncia ou requisição de inquérito policial.
II. O Ministério Público poderá oferecer proposta de transação penal a Ricardo, primário e de bons antecedentes, acusado
de cometer crime eleitoral previsto no artigo 39, da Lei no9.507/1997, ao ser surpreendido realizando propaganda de
boca de urna no último pleito, crime este punível com detenção de 6 meses a 1 ano e multa.
III. O Ministério Público não poderá oferecer proposta de transação penal a Rodolfo, primário e de bons antecedentes, e
acusado de cometer crime de usurpação de função pública, previsto no artigo 328, do Código Penal, que prevê pena de
detenção de 3 meses a 2 anos e multa.
Está correto o que consta APENAS em",a) II e III. | b) II. | c) I e III. | d) I e II. | e) I.,d,2017
"Xisto, policial militar rodoviário no exercício da função, resolve em um único dia de trabalho praticar três crimes de corrupção
passiva, utilizando para tanto o mesmo modus operandi, solicitando dinheiro de condutores de veículos para não fazer a
autuação administrativa pelo excesso de velocidade. O primeiro crime é praticado às 09h na cidade de Guarulhos. O segundo é
praticado às 12h na cidade de Mogi das Cruzes. E o terceiro é praticado às 14h na cidade de Jacareí, onde Xisto é preso em
flagrante por policiais civis, prisão esta analisada e mantida pelo Magistrado competente daquela comarca. Xisto é denunciado
pelo Ministério Público da comarca de Jacareí pelos três crimes de corrupção passiva. Sobre o caso hipotético apresentado e à
luz do Código de Processo Penal, a competência da comarca de Jacareí foi determinada",a) por conexão. | b) por continência. | c) por prevenção. | d) pela prerrogativa de função. | e) pelo lugar da infração.,c,2017
