Perguntas,Alternativas,Resposta,Ano
"Segundo a Lei de Execução Penal, são órgãos da execu- ção penal:","a) o Conselho da Comunidade e a direção do estabelecimento prisional. | b) a Defensoria Pública e o Patronato, mas não o Ministério Público. | c) o Juízo da Execução Penal e o Conselho Penitenciário. | d) o Conselho Nacional de Política Criminal e Penitenciária, mas não o Patronato. | e) a direção do estabelecimento prisional e os Departamentos Penitenciários, mas não a Defensoria Pública.",c,2014
"Amanda foi presa em flagrante delito pela prática de concussão.
A defesa ingressou com pedido de liberdade provisória
e de conversão da prisão preventiva em domiciliar,
porque Amanda tem filho de sete anos de idade. Ao analisar
tais pedidos e diante do que consta dos autos, NÃO
poderia ser utilizado, pelo juízo, para indeferi-los, o argumento:","a) a prisão é necessária por conveniência da instrução processual, porque Amanda exigia das vítimas vantagem ilícita mediante grave ameaça, havendo, portanto, temor de que a sua liberdade possa intimidar as testemunhas. | b) possuir ocupação lícita e residência fixa não são suficientes para garantir a liberdade provisória. | c) incabível o pedido de conversão em prisão domiciliar porque o caso não se enquadra na hipótese prevista em lei. | d) incabível a concessão judicial de liberdade provisó- ria, porque a pena privativa de liberdade máxima cominada ao delito é superior a 4 (quatro)  anos. | e) incabível a concessão judicial de liberdade provisó- ria, porque presentes os requisitos que autorizam a prisão preventiva.",d,2014
"Considere persecução penal baseada na prisão em flagrante
dos acusados em situação de participação em narcotraficância
transnacional, obstada pela Polícia Federal,
que os encontrou tendo em depósito 46.700 gramas de
cocaína graças à informação oriunda de notícia anônima.
Neste caso, segundo entendimento jurisprudencial consolidado,","a) é nulo o processo ab initio, ante a vedação constitucional do anonimato. | b) a notícia anônima sobre eventual prática criminosa é, por si, idônea para instauração de inquérito policial. | c)  a notícia anônima sobre eventual prática criminosa presta–se a embasar procedimentos investigatórios preliminares que corroborem as informações da fonte anônima, os quais tornam legítima a persecução criminal. | d) a autoridade policial não pode tomar qualquer providência investigatória a partir da notícia anônima. | e) a persecução criminal só poderia ser iniciada se a denúncia anônima estivesse corroborada por interceptação telefônica autorizada judicialmente.",c,2014
"No procedimento dos juizados especiais criminais, contraa decisão que rejeita a denúncia cabível","a) apelação, no prazo de cinco dias, a ser julgada por turma composta de três juízes em exercício no primeiro grau de jurisdição. | b) apelação, no prazo de dez dias, a ser julgada por turma composta de três juízes em exercício no primeiro grau de jurisdição. | c) recurso em sentido estrito, no prazo de cinco dias, a ser julgado pelo Tribunal de Justiça. | d) apelação, no prazo de cinco dias, a ser julgada pelo Tribunal de Justiça. | e) recurso em sentido estrito, no prazo de dez dias, a ser julgado por turma composta de três juízes em exercício no primeiro grau de jurisdição.",b,2014
"Aristides foi denunciado pela prática do delito de apropria–
ção indébita previdenciária. Procurado para ser citado em
sua residência, não foi localizado. Aristides foi então citado
por edital. Não respondeu à citação, nem constituiu
advogado. Diante disso, o juiz deverá","a) determinar a suspensão do processo e do curso prescricional. | b) determinar tão somente a suspensão do processo. | c)  determinar a suspensão do processo e, por isso, decretar a prisão preventiva de Aristides. | d) nomear defensor dativo para apresentação de resposta. | e) determinar a citação de Aristides com hora certa.",a,2014
"Compete ao Juizado Especial Federal Criminal processar e julgar os feitos de competência da Justiça Federal relativos às infrações de menor potencial ofensivo, respeitadas as regras de conexão e continência. Consideram-se infrações de menor potencial ofensivo as contravenções e os crimes a que a lei comine pena máxima NÃO superior a","a) três anos, cumulada ou não com multa. | b) dois anos, cumulada ou não com multa. | c) dois anos, desde que não cumulada com multa. | d) um ano, desde que não cumulada com multa. | e) dois anos e seis meses, cumulada ou não com multa.",b,2012
"No que toca as nulidades no Processo Penal, é correto afirmar que","a) a falta ou a nulidade da citação, da intimação ou notificação estará sanada, desde que o interessado compareça, antes de o ato consumar-se, embora declare que o faz o único fim de argui-la. O juiz ordenará, todavia, a suspensão ou o adiamento do ato, salvo quando houver risco de prescrição. | b) não é nulo o julgamento da apelação se, após a manifestação nos autos da renúncia do único defensor, o réu não foi previamente intimado para constituir outro. | c) nenhum ato será declarado nulo se da nulidade resultar prejuízo para a acusação. | d) a nulidade por ilegitimidade do representante da parte é absoluta e não pode ser sanada. | e) constitui nulidade a falta de intimação do denunciado para oferecer contrarrazões ao recurso interposto da rejeição da denúncia, não a suprindo a nomeação de defensor dativo.",e,2014
"Antônio, assistido por Defensor Público, foi condenado em primeiro grau pela prática do delito de roubo qualificado. Interposto e arrazoado recurso de apelação contra esta decisão, a defesa de Antônio não foi intimada da inclusão, em pauta de julgamento, do seu recurso de apelação. Diante disso,",a) a intimação pessoal do Defensor Público era medida necessária. | b) apenas a intimação do Ministério Público deveria ter sido pessoal. | c) a falta de intimação pela imprensa do Defensor Público é causa de nulidade absoluta. | d) era necessária a intimação do Defensor Público por publicação no órgão incumbido da publicidade dos atos judiciais da comarca. | e) a intimação do Ministério Público poderia ter sido feita por órgão incumbido da publicidade dos atos judiciais da comarca.,a,2014
"José, preso preventivamente pela prática do delito de tráfico de entorpecentes, impetrou habeas corpus em causa própria no Tribunal local. Segundo o Código de Processo Penal,","a) se o Tribunal verificar que já cessou a violência ou coação ilegal, julgará o mérito do pedido da impetra- ção. | b) o pedido somente pode ser conhecido depois de a Defensoria Pública devidamente arrazoá-lo. | c) caso o habeas corpus seja concedido em virtude de nulidade do processo, este não pode ser renovado, em razão da proibição de bis in idem. | d) havendo empate na votação, se o presidente não tiver tomado parte na votação, proferirá voto de desempate, ou, no caso contrário, prevalecerá a decisão mais favorável ao paciente. | e) o Ministério Público não poderia ter impetrado habeas corpus em favor de José.",d,2014
"Em relação às disposições constitucionais aplicáveis ao direito processual penal,","a) em caso de crimes processados mediante ação penal de iniciativa pública, o oferecimento da ação penal é de competência privativa e exclusiva do Ministério Público. | b) a pena será cumprida em estabelecimentos distintos, de acordo com a natureza do delito, o sexo e também a idade do apenado. | c) a defesa técnica no processo penal, como garantia exclusiva do acusado, é renunciável, desde que a renúncia seja homologada pelo juiz constitucionalmente competente. | d) a garantia constitucional da duração razoável do processo somente se aplica à segunda fase da persecução penal, consubstanciada na ação penal de conhecimento de natureza condenatória. | e) a regra, no processo penal, é a publicidade restrita, em razão do caráter infamante do processo penal.",b,2014
"No procedimento comum,","a) incabível a rejeição da denúncia quando faltar justa causa para o exercício da ação penal, circunstância que só pode conduzir à absolvição sumária. | b) o acusado, na resposta, apenas poderá alegar tudo o que seja de interesse de sua defesa quanto ao mérito da acusação. | c) caberá a absolvição sumária quando o juiz verificar a existência manifesta de qualquer causa excludente da culpabilidade. | d) a parte poderá desistir da inquirição de qualquer das testemunhas arroladas, mas ao magistrado é facultado ouvi–la como testemunha do juízo. | e) a sentença sempre pode ser proferida por juiz diverso do que tenha presidido a instrução.",d,2014
"Antonio é prefeito municipal que exerce mandato desde 2013. Ante a notícia de que teria, em 2011, praticado delito de apropriação indébita previdenciária, previsto no artigo 168-A, do Código Penal, enquanto sócio gerente de uma metalúrgica, a competência para processá-lo e julgálo agora por tal crime é do",a) juiz de primeiro grau da respectiva seção judiciária onde teria ocorrido o delito. | b) Supremo Tribunal Federal. | c) Superior Tribunal de Justiça. | d) Tribunal Regional Federal do local onde teria ocorrido o delito. | e) Tribunal de Justiça do Estado onde teria ocorrido o delito.,d,2014
"Antonio, empresário do ramo de construção civil, foi difamado
e injuriado por José, seu vizinho. Antonio faleceu
quinze dias depois do ocorrido. Para que José seja processado
criminalmente pelas ofensas,","a) extingue-se a punibilidade de José em razão do falecimento de Antonio. | b) a esposa de Antonio, ou seu filho, poderá oferecer queixa contra José. | c) o Ministério Público deverá oferecer denúncia contra José. | d) a esposa de Antonio deverá oferecer representação para que o Ministério Público possa oferecer denúncia contra José. | e) o filho de Antonio deverá oferecer representação para que o Ministério Público possa oferecer denúncia contra José.",b,2014
"Em relação à busca e apreensão no processo penal, é INCORRETO afirmar que","a) não sendo encontrada a pessoa ou coisa procurada, os motivos da diligência serão comunicados a quem tiver sofrido a busca, se o requerer. | b) o mandado de busca e apreensão deverá mencionar o motivo e os fins da diligência. | c) as buscas domiciliares com ordem judicial serão executadas de dia, salvo se o morador consentir que se realizem à noite. | d) a autoridade, ou seus agentes, nunca pode penetrar no território de jurisdição alheia, se de outro Estado. | e) a busca pessoal independerá de mandado, no caso de prisão.",d,2014
A sentença penal será publicada,"a) quando não houver sido decretado sigilo ou segredo de justiça. | b) em mão do escrivão, que a encaminhará para a imprensa oficial ou para jornal de grande circulação, registrando-a em livro especialmente destinado a esse fim. | c) somente pelo juiz que a prolatou, devendo o escrivão dar cumprimento à decisão. | d) em mão do escrivão, que lavrará nos autos o respectivo termo, registrando-a em livro especialmente destinado a esse fim. | e) após o trânsito em julgado em face do princípio da presunção da inocência.",d,2014
"Em relação à prisão temporária,","a) poderá ser prorrogada quantas vezes forem necessárias, desde que a prisão temporária seja imprescindível para investigação da infração penal. | b) o preso somente pode ser posto em liberdade mediante alvará de soltura expedido pelo juiz que decretou a prisão temporária. | c) poderá ser decretada em caso de crime grave ou hediondo, para assegurar a aplicação da lei penal. | d) poderá ser decretada em qualquer fase da investigação policial ou do processo penal. | e) o Juiz poderá, de ofício, determinar que o preso lhe seja apresentado.",e,2014
"Quanto ao interrogatório, correto afirmar:","a) Da decisão que determinar a sua realização por videoconferência as partes deverão ser intimadas com dez dias de antecedência. | b) É possível a realização por videoconferência para impedir a influência do réu no ânimo de testemunha ou da vítima, ainda que viável a colheita do depoimento destas pelo mesmo sistema. | c) Deve ser efetivado na presença do defensor, dispensado o direito de entrevista prévia e reservada no caso de advogado constituído. | d) A ausência do ato constitui nulidade relativa, passível de preclusão se não arguida em tempo oportuno. | e) O réu deverá ser informado pelo juiz do seu direito de permanecer calado, bem como de que o silêncio poderá repercutir em seu desfavor.",a,2014
"NÃO cabe a substituição da prisão preventiva pela domiciliar,
ainda que o agente seja","a) semi–imputável, assim declarado por regular perícia, que tenha praticado crime com violência ou grave ameaça. | b) imprescindível aos cuidados especiais de pessoa menor de 6 (seis)  anos de idade ou com deficiência. | c) extremamente debilitado por motivo de doença grave. | d) gestante a partir do 7º (sétimo)  mês de gravidez ou sendo esta de alto risco. | e) maior de 80 (oitenta)  anos.",a,2014
"José responde, preso, a processo pela prática do delito de tráfico de drogas. Diante disso, é correto afirmar que","a) sob o título de prisão temporária, José pode ficar preso no curso da ação penal por no máximo 60 dias. | b) a prisão preventiva de José pode ter sido decretada de ofício no curso do inquérito policial. | c) mesmo que cumpridos todos os demais requisitos, o Supremo Tribunal Federal, por maioria, tem entendido que não é possível a concessão de liberdade provisória a José. | d) sob o título de prisão temporária, José pode ter ficado preso no curso do inquérito policial por no máximo 10 dias. | e)  na hipótese de ter havido representação da autoridade policial, o Juiz, antes de decidir pela decreta- ção da prisão temporária, teve que ouvir o Ministério Público.",e,2014
"No tocante à ação penal, de acordo com o Código de Processo Penal,","a) o direito de representação somente poderá ser exercido pessoalmente, mediante declaração escrita. | b) no caso de ação penal de iniciativa pública dependente de representação, esta será irretratável depois de oferecida a denúncia. | c) apenas a vítima poderá provocar a iniciativa do Ministério Público nos casos em que caiba ação penal pública incondicionada. | d) se o órgão do Ministério Público, ao invés de apresentar a denúncia, requerer o arquivamento do inquérito policial ou de quaisquer peças de informação, o ofendido poderá promover ação penal de iniciativa privada subsidiária da pública. | e) salvo disposição em contrário, o ofendido, ou seu representante legal, decairá do direito de queixa ou de representação, se não o exercer dentro do prazo de 30 dias, contado da data do crime.",b,2014
O intérprete não poderá atuar na ação penal em que,a) o juiz tiver conhecimento do idioma do acusado. | b) tiver funcionado como intérprete durante a lavratura do auto de prisão em flagrante delito. | c) a parte não concordar com a sua nomeação. | d) o Ministério Público não for ouvido sobre a sua nomeação. | e) tiver prestado depoimento no processo.,e,2014
"Arquivado o inquérito policial por despacho do juiz, a requerimento do Ministério Público, a ação penal","a) só poderá ser instaurada com base em novas provas. | b) só poderá ser instaurada se o pedido de arquivamento do Ministério Público tiver se baseado em prova falsa. | c) não poderá mais ser instaurada por ter se exaurido a atividade de acusação. | d) não poderá mais ser instaurada, pois implicaria revisão prejudicial ao acusado. | e) só poderá ser instaurada se houver requisição do Procurador-Geral de Justiça.",a,2011
"Em relação aos recursos no processo penal, é correto afirmar:","a) O recurso poderá ser interposto pelo Ministério Público, ou pelo querelante, ou pelo réu, seu procurador ou seu defensor. | b) Caberá recurso em sentido estrito da decisão que impronunciar o réu. | c) Caberá recurso em sentido estrito da decisão que deferir pedido de prisão preventiva. | d) Convencido pelas contrarrazões da defesa, o Ministério Público poderá desistir do recurso que haja interposto. | e) Caberá recurso em sentido estrito da decisão que conceder, mas não da que negar fiança.",a,2014
"Jorge foi denunciado pela prática de crime contra a ordem tributária. De acordo com o disposto no Código de Processo Penal, éINCORRETO afirmar que",a) Jorge deverá ser absolvido sumariamente se o fato narrado na denúncia evidentemente não constitui crime. | b) a denúncia será rejeitada quando for manifestamente inepta. | c) a denúncia será rejeitada quando faltar pressuposto processual ou condição para o exercício da ação penal. | d) a existência manifesta de causa excludente da ilicitude do fato somente poderá ser assim apurada depois da audiência de instrução e julgamento. | e) a denúncia será rejeitada quando faltar justa causa para o exercício da ação penal.,d,2014
"De acordo com a Lei no 11.343/06,","a) o perito que subscrever o laudo de constatação da natureza e quantidade da droga, em razão da prisão em flagrante, ficará impedido de participar da elaboração do laudo definitivo. | b) em qualquer fase da persecução criminal relativa aos crimes previstos nesta lei, é permitida, em razão da urgência e por isso independentemente de autorização judicial, a infiltração por agentes de polícia, em tarefas de investigação, constituída pelos órgãos especializados pertinentes. | c) os crimes previstos no artigo 33 desta lei são suscetíveis de liberdade provisória, de acordo com recente orientação do Supremo Tribunal Federal. | d) o pedido de restituição de bem apreendido em razão da prática de crime previsto nesta lei será conhecido independentemente do comparecimento pessoal do acusado. | e) o indiciado ou acusado que colaborar voluntariamente com a investigação policial e o processo criminal na identificação dos demais coautores ou partícipes do crime e na recuperação total ou parcial do produto do crime, no caso de condenação, terá pena reduzida de um terço a metade.",c,2013
"No tocante à prisão, medidas cautelares e liberdade provisória, de acordo com a redação expressa no Código de Processo Penal,","a) as medidas cautelares relativas à prisão deverão ser aplicadas, observando-se a adequação da medida às circunstâncias do fato, mas não à gravidade do crime ou às condições pessoais do indiciado ou acusado. | b) as medidas cautelares relativas à prisão deverão ser aplicadas observando-se a necessidade para aplicação da lei penal, para a investigação ou a instrução criminal e, nos casos expressamente previstos, para evitar a prática de infrações penais. | c) as medidas cautelares não podem ser aplicadas cumulativamente. | d) o juiz poderá revogar a medida cautelar ou substituí-la quando verificar a falta de motivo para que subsista, mas não pode voltar a decretá-la se sobrevierem razões que eventualmente a justificassem. | e) no caso de descumprimento de qualquer das obrigações impostas, o juiz, apenas a requerimento do Ministério Público, poderá substituir a medida.",b,2013
"Em relação à citação no processo penal, é correto afirmar que","a) o processo terá completada a sua formação quando realizada a citação do acusado. | b) é nula a citação por edital que apenas indique o dispositivo de lei penal e não transcreva a denúncia ou queixa ou não resuma os fatos em que se baseia. | c) se o acusado, citado por edital, não comparecer, nem constituir advogado, ficará suspenso o processo, mas não o curso do prazo prescricional. | d) verificando que o réu se oculta para não ser citado, o oficial de justiça certificará a ocorrência e o juiz determinará a citação por edital, com prazo de 15 (quinze)  dias. | e) se o réu estiver preso, não precisa ser pessoalmente citado.",a,2013
"No tocante à competência no processo penal, é correto afirmar que","a) se o réu não tiver residência certa ou for ignorado o seu paradeiro, será competente o juiz que primeiro tomar conhecimento do fato. | b) nos casos de exclusiva ação privada, o querelante poderá preferir o foro de domicílio ou residência do réu, somente se desconhecido o lugar da infração. | c) a competência especial por prerrogativa de função, relativa a atos administrativos do agente, prevalece ainda que o inquérito ou a ação judicial sejam iniciados após a cessação do exercício da função pública. | d) na determinação da competência por conexão ou continência, no concurso entre a jurisdição especial e a comum, prevalecerá esta. | e) a competência será, de regra, determinada pelo lugar em que se consumar a infração, ou, caso de tentativa, pelo lugar em que for praticado o maior número de atos de execução.",a,2013
Atenção: Para responder às questões de números 25 a 29 assinalea alternativa correta em relação ao assunto indicado.Recursos.,"a) O recurso de apelação interposto por defensor público só será conhecido pelo juízo sentenciante se apresentado com as respectivas razões, tendo em vista que a lei processual penal apenas faculta a juntada das razões quando o referido recurso for interposto pelo pró prio condenado. | b) De acordo com a jurisprudência do Superior Tribunal de Justiça, no âmbito do recurso especial não é possível a revaloração da prova, tendo em vista que exigirá a aná lise do contexto fático-probatório dos autos. | c) A repercussão geral, como requisito de admissibilidade do recurso extraordinário, é presumida quando o recurso impugnar decisão contrária à súmula ou jurisprudência dominante do Tribunal. Nesse caso, não haverá a necessidade de demonstração formal em preliminar do recurso. | d) Intimado pessoalmente o defensor público de decisão de turma recursal que negou provimento à apelação interposta, incabível a interposição de recurso extraordinário por ausência de previsão legal. | e) Segundo o entendimento do Superior Tribunal de Justiça, o recurso especial não se presta ao exame de suposta afronta a dispositivos constitucionais, sob pena de invasão da competência reservada ao Supremo Tribunal Federal.",e,2013
"Analise as assertivas abaixo. I. A apresentação pelo acusado da prática de furto, no curso do processo, de prévio contrato de compra e venda que o identifique como o comprador da res furtiva, impõe ao magistrado a suspensão do processo criminal e o encaminhamento das partes ao juízo cível, por tratar-se de questão prejudicial de natureza heterogênea. II. Nos termos da lei processual penal, a restituição de bens apreendidos constitui ato privativo do juiz criminal competente, não podendo ser concedida pela autoridade policial, em razão da existência de efeitos extrapenais da sentença condenatória. III. Segundo o entendimento pacífico do Supremo Tribunal Federal, não podem subsistir condenações penais fundadas unicamente em prova produzida na fase do inquérito policial, sob pena de grave afronta às garantias constitucionais do contraditório e da ampla defesa. IV. O acusado, embora preso, tem o direito de comparecer, de assistir e de presenciar, sob pena de nulidade absoluta, os atos processuais, notadamente aqueles que se produzem na fase de instrução do processo penal. Está correto APENAS o que se afirma em",a) I; III e IV. | b) I e II. | c) III e IV. | d) II e III. | e) I; II e IV.,c,2013
"Quando duas ou mais pessoas forem acusadas pela prática da mesma infração penal e quando a prova de uma infração penal ou de qualquer de suas circunstâncias elementares influir na prova de outra infração penal, justifica-se a fusão dos processos pela","a) continência e conexão, respectivamente. | b) conexão e continência, respectivamente. | c) continência. | d) conexão intersubjetiva. | e) conexão instrumental.",a,2013
"No tocante à atividade probatória no processo penal, de acordo com o Código de Processo Penal,","a) as provas ilícitas, obtidas em violação a normas legais, são inadmissíveis, sendo facultado seu desentranhamento dos autos do processo. | b) o juiz formará sua convicção pela livre apreciação da prova produzida em contraditório judicial, sendo-lhe vedado utilizar os elementos informativos colhidos na investigação para fundamentar a sua decisão, mesmo tratando-se de provas cautelares. | c) é possível provar o estado das pessoas por qualquer meio de prova admissível no processo penal, independentemente das restrições estabelecidas na lei civil. | d) a prova da alegação incumbirá a quem a fizer, sendo, porém, facultado ao juiz, de ofício, determinar, no curso da instrução, ou antes de proferir sentença, a realização de diligências para dirimir dúvida sobre ponto relevante. | e) quando a infração deixar vestígio, será indispensável o exame de corpo de delito, direto ou indireto, salvo se já houver confissão do acusado.",d,2013
