Perguntas,Alternativas,Resposta,Ano
"Instaurado inquérito policial por crime de ação pública, este poderá ser arquivado pelo","a) Escrivão de Polícia, mediante ordem da autoridade policial. | b) Juiz, após a manifestação do Ministério Público. | c) Delegado de Polícia, mediante parecer do Ministério Público. | d) Ministério Público, quando o fato não for criminoso. | e) Delegado de Polícia, mediante requerimento escrito da vítima.",b,2009
Assinale a alternativa que NÃO corresponde a súmula do Superior Tribunal de Justiça ou do Supremo Tribunal Federal.,"a) O efeito devolutivo da apelação contra decisões do Júri é adstrito aos fundamentos da interposição. | b) Intimada a defesa da expedição da carta precatória, torna-se desnecessária intimação da data da audiência no juízo deprecado. | c) Compete ao foro do local da emissão julgar o crime de estelionato mediante emissão de cheque sem fundos. | d) Compete ao juízo do local da obtenção da vantagem ilícita processar e julgar crime de estelionato cometido mediante falsificação de cheque. | e) É concorrente a legitimidade do ofendido, mediante queixa e do Ministério Público, condicionada à representação do ofendido, para a ação penal por crime contra a honra de servidor público em razão do exercício de suas funções.",c,2009
"Avaliando inquérito policial instaurado para apurar eventual crime de roubo cometido por João, o promotor de justiça decide por requerer o arquivamento, sendo o pedido homologado pelo juiz. Menos de seis meses depois, o ofendido oferece queixa-crime. O juiz deverá","a) receber a queixa, pois em caso de arquivamento de inquérito é possível ser reaberto com novas provas. | b) receber a queixa, porque ainda não houve deca- dência. | c) rejeitar a queixa, porque o crime de roubo é de ação penal pública e nunca ensejaria queixa subsidiária. | d) receber a queixa, porque se trata de hipótese de ação penal privada subsidiária da pública e foi ajuizada no prazo legal. | e) rejeitar a queixa, com o fundamento de que a queixa subsidiária somente é cabível em caso de inércia do promotor, não quando este pede o arquivamento.",e,2009
"No processo ordinário, depois da resposta do réu, o juiz o absolverá sumariamente se presente um dos motivos para o julgamento antecipado, nos quais NÃO se inclui:","a) estar extinta a punibilidade do agente. | b) a existência manifesta de causa excludente da ilicitude do fato. | c) a existência manifesta de causa excludente da culpabilidade do agente, salvo inimputabilidade. | d) o fato narrado evidentemente não constitui crime. | e) denúncia assinada por Promotor de Justiça incompetente.",e,2009
"As regras estabelecidas no Código de Processo Penal atinentes ao recebimento e rejeição da denúncia, à res- posta do réu e ao julgamento antecipado, aplicam-se","a) também aos procedimentos penais de segundo grau. | b) aos procedimentos regulados no próprio Código de Processo, apenas. | c) ao procedimento ordinário, apenas. | d) a todos os procedimentos penais de primeiro grau, ainda que previstos em leis especiais. | e) a todos os procedimentos, com exceção do sumaríssimo previsto para infrações penais de menor potencial ofensivo.",d,2009
"No que se refere ao direito de representação previsto no Código de Processo Penal, considere o seguinte:I. É exercido pelo ofendido ou seu representante legal, constituindo condição de procedibilidade.II. Depois de exercido, a representação é irretratável.III. No caso de morte da vítima, ou quando declarada ausente por decisão judicial, passará ao seu cônjuge, ascendente, descendente ou irmão.IV. Só pode ser exercido no prazo de 6 (seis) meses, contado da data em que o ofendido ou seu repre- sentante vier a saber quem foi o autor do crime. Está correto o que se afirma SOMENTE em:","a) I, III e IV. | b) I, II e IV. | c) I, II e III. | d) I e IV. | e) III e IV.",a,2009
"Da decisão do Juiz do Tribunal do Júri que, encerrada a fase de instrução preliminar, absolve desde logo o réu, porque o fato não constitui infração penal, cabe recurso",a) de apelação. | b) ex officio. | c) protesto por novo Júri. | d) revisão criminal. | e) especial.,b,2009
"Quanto aos efeitos, as questões prejudiciais podem ser",a) objetivas e subjetivas. | b) homogêneas e heterogêneas. | c) absolutas e relativas. | d) principais e secundárias. | e) obrigatórias e facultativas.,e,2009
"Segundo a lei processual penal, são consideradas espécies de prisão em flagrante:","a) preparado, putativo e próprio. | b) forjado, presumido e especial. | c) próprio, forjado e presumido. | d) esperado, presumido e preparado. | e) próprio, impróprio e presumido.",e,2009
"A apresentação espontânea do acusado à autoridade, segundo a legislação processual brasileira:",a) Autoriza a revogação da prisão preventiva decretada. | b) Impede a decretação da prisão temporária. | c) Impede a decretação da prisão preventiva. | d) Autoriza a prisão em flagrante. | e) Não impede a decretação da prisão preventiva nos casos em que a lei a autoriza.,e,2009
A respeito do Inquérito Policial é correto afirmar:,"a) O Inquérito Policial pode ser presidido pelo Ministério Público. | b) O Inquérito Policial uma vez instaurado, não poderá ser arquivado pela autoridade policial. | c) O sigilo do Inquérito Policial, necessário à elucidação do fato, estende-se ao Ministério Público. | d) O princípio do contraditório deve ser observado no Inquérito Policial. | e) O Inquérito Policial constitui-se na única forma de investigação criminal.",b,2009
"A ação penal pública incondicionada, excetuados os delitos de pequeno potencial ofensivo, é regida, entre outros, pelos princípios da","a) disponibilidade, indivisibilidade e oficialidade. | b) obrigatoriedade, oficialidade e oportunidade. | c) legalidade, oportunidade e intranscendência. | d) obrigatoriedade, conveniência e intranscendência. | e) legalidade, indisponibilidade e intranscendência.",e,2009
"A decisão que deixa de receber a denúncia, ofertada por crime de roubo, pode ser atacada por",a) carta testemunhável. | b) apelação. | c) agravo em execução. | d) recurso em sentido estrito. | e) recurso extraordinário.,d,2009
"São requisitos formais da sentença, dentre outros:","a) Inexistência de litispendência e de questões prejudiciais. | b) Transcrição integral da denúncia ou queixa e das razões recursais. | c) Exposição sucinta da acusação e da defesa, nomes das partes e dispositivo. | d) Elaboração por Juiz não impedido nem suspeito. | e) Publicação e intimação do órgão do Ministério Público e da defesa.",c,2009
"Diante da morte do ofendido, caso o direito de prosseguir na ação penal privada não seja exercitado dentro de 60 dias, ocorrerá a extinção da punibilidade em decorrência da",a) perempção. | b) prescrição da pretensão punitiva. | c) renúncia. | d) decadência. e) retratação.,a,2009
"A respeito da determinação da competência por conexão ou continência, considere:I. No concurso de jurisdições da mesma categoria, prevalecerá a do lugar em que houver ocorrido o maior número de infrações, independentemente da gravidade das respectivas penas.II. No concurso entre a jurisdição comum e a especial prevalecerá a comum.III. Compete à Justiça Federal o processo e julgamento unificado dos crimes conexos de competência federal e estadual. Está correto o que se afirma APENAS em",a) I. | b) I e II. | c) I e III. | d) II e III. | e) III.,e,2009
A competência fixada pela circunstância de duas ou mais pessoas serem acusadas pela mesma infração é determinada,a) pela prevenção. | b) por conexão. | c) pela natureza da infração. | d) pela continência. | e) por distribuição.,d,2009
"De acordo com a lei de execução penal,","a) é cabível o recurso de agravo, com efeito suspensivo, contra as decisões proferidas na fase de execução. | b) é dispensável a prévia oitiva do condenado no incidente de regressão. | c) o respectivo procedimento judicial poderá ter início por proposta do Conselho Penitenciário. d) os incidentes de excesso ou desvio de execução só podem ser suscitados pelo sentenciado ou pelo Mi nistério Público. | e) é inadmissível a substituição da pena privativa de liberdade por medida de segurança, ainda que sobrevenha doença mental.",c,2009
O inquérito policial no caso de ação penal pública incondicionada,a) depende de requerimento da vítima. | b) pode ser instaurado de ofício. | c) depende de requisição do Ministério Público. | d) não pode ser instaurado pela prisão em flagrante delito. | e) depende de requisição do juiz.,b,2009
"Nos crimes relativos à violência doméstica ou familiar contra a mulher, cujas ações penais sejam condicionadas à representação da ofendida,","a) se a vítima manifestar a intenção de renunciar ao direito de representação na fase do inquérito, a autoridade policial tomará por termo das suas declarações e ordenará o arquivamento. | b) a vítima poderá renunciar ao direito de representação a qualquer momento, em favor da harmonia da vida em comum. | c) a renúncia à representação poderá ser feita perante o Ministério Público, em qualquer fase do processo. | d) só será admitida a renúncia à representação perante o juiz, em audiência especialmente designada com tal finalidade, antes do recebimento da denúncia e ouvido o Ministério Público. | e) se a vítima estiver representada por advogado, a renúncia ao direito de representação perante a autoridade policial dependerá da sua anuência.",d,2009
Existe previsão legal de prioridade no julgamento de ação penal se,"a) alguma das partes for mulher em situação de violência, a requerimento do Defensor Público. | b) forem discutidos direitos relativos a criança ou adolescente vítima de abuso sexual, sem necessidade de requerimento ao juiz. | c) for decretado segredo de justiça, a pedido do Ministério Público. | d) o acusado for pessoa idosa, desde que requeira ao juiz. | e) o acusado for integrante de organização criminosa.",d,2009
"De acordo com a lei processual, o interrogatório do réu preso será realizado, em regra,","a) pessoalmente, com o comparecimento do juiz no estabelecimento onde estiver o interrogando recolhido. | b) pessoalmente, devendo o interrogando ser requisita do e escoltado ao juízo. | c) por carta precatória, devendo o interrogando ser requisitado e escoltado ao juízo deprecado. | d) através de recurso tecnológico de transmissão de sons e imagens em tempo real. | e) através do telefone, com linha reservada, desde que não haja outro meio.",a,2009
O prazo de decadência do direito do empregador deajuizar inquérito em face do empregado que incorre emabandono de emprego é contado,a) a partir do primeiro dia útil posterior ao dia em que o empregado abandonou o serviço. | b) a partir do momento em que o empregado abandonou o serviço. | c) a partir do momento em que o empregado pretendeu o seu retorno ao serviço. | d) após 30 dias do momento em que o empregado abandonou o serviço. | e) após 30 dias do momento em que o empregado pretendeu o seu retorno ao serviço.,c,2009
"A recente reforma processual penal ocorrida pela publicação de três leis no ano de 2008, em relação ao sistema anterior, aboliu",a) o recurso em sentido estrito e a carta testemunhável. | b) o agravo e o protesto por novo júri. | c) apenas a carta testemunhável. | d) apenas o protesto por novo júri. | e) a carta testemunhável e o protesto por novo júri.,d,2009
Denomina-se flagrante impróprio ou quase-flagrante a prisão de quem,"a) é perseguido, logo após, pela autoridade, pelo ofendido ou por outra pessoa, em situação que faça presumir ser autor da infração. | b) está cometendo a infração penal. | c) acaba de cometer a infração penal. | d) é encontrado, logo depois, com instrumentos, armas, objetos ou papéis que façam presumir ser ele autor da infração. | e) é encontrado, dias depois, de posse da arma com a qual o delito foi praticado.",a,2009
Incabível a prisão temporária em caso de,a) roubo simples. | b) quadrilha ou bando. | c) homicídio simples. | d) cárcere privado. | e) furto qualificado.,e,2009
A ação penal,"a) privada subsidiária da pública poderá ser proposta pelo ofendido ou seu representante legal quando o juiz deferir pedido de arquivamento tempestivamente formulado pelo Ministério Público. | b) nas contravenções penais será iniciada por portaria expedida pela autoridade policial. | c) pública será instaurada por denúncia do Ministério Público, que dela poderá desistir se convencer-se da inocência do acusado. | d) pública condicionada à representação da vítima será julgada extinta se esta se retratar antes da sentença. | e) privada, quando o ofendido for declarado ausente por decisão judicial, poderá ser intentada por seu cônjuge, ascendente, descendente ou irmão.",e,2009
"A respeito dos recursos em geral, considere: I. O Ministério Público poderá desistir de recurso que haja interposto. II. Salvo a hipótese de má-fé, a parte não será prejudicada pela interposição de um recurso por outro. III. Não será admitido recurso da parte que não tiver interesse na reforma ou modificação da decisão. Está correto o que se afirma SOMENTE em",a) II e III. | b) I e III. | c) I. | d) II. | e) I e II.,a,2009
A condenação de um réu sem defensor viola o princípio,a) da oficialidade. | b) da publicidade. | c) do juiz natural. | d) da verdade real. | e) do contraditório.,e,2009
"A respeito da ação penal pública, é correto afirmar que","a) pode ser instaurada pelo juiz de ofício. | b) só pode ser instaurada mediante prévio inquérito policial. | c) depende sempre da representação do ofendido. | d) a sua propositura cabe privativamente ao Ministério Público. | e) o Ministério Público, após a sua instauração, pode dela desistir.",d,2009
"A prisão preventiva, segundo o Código de Processo Penal, pode ser decretada","a) mediante requerimentos do Ministério Público, do assistente e do querelante. | b) de ofício pelo juiz, a requerimento do Ministério Público ou do querelante ou mediante representação da autoridade policial. | c) mediante representações da autoridade policial e do ofendido e requerimentos do Ministério Público e do querelante. | d) de ofício, mediante representações do Ministério Público e do querelante e requerimento da autoridade policial. | e) mediante propostas dos Tribunais de Justiça dos Estados e dos Tribunais Regionais Federais.",b,2009
"São condições da ação penal, que devem ser analisadas pelo juiz quando do recebimento da denúncia ou da queixa:","a) a descrição do fato criminoso em todas as circunstâncias, a classificação e a qualificação do acusado. | b) o prazo, a forma e o destinatário. | c) a possibilidade jurídica do pedido, o interesse de agir e a legitimação para agir. | d) que o fato narrado constitua crime, que a parte seja legítima e que esteja presente condição de procedibilidade. | e) a legitimação para agir, a qualificação do acusado e o prazo.",c,2009
"Dentre os princípios característicos do processo penal moderno, segundo a doutrina, é correto destacar:","a) da obrigatoriedade, do contraditório, do estado de inocência, da fungibilidade, da legalidade. | b) da ampla defesa, da oficialidade, da indisponibilidade, da indesistibilidade, da legalidade. | c) da verdade real, da indivisibilidade, da oportunidade, da intranscendência, da informalidade. | d) do estado de inocência, do contraditório, da verdade real, da oralidade, da publicidade, do juiz natural. | e) da economia processual, da ampla defesa, da indivisibilidade, da obrigatoriedade.",d,2009
"No caso de processo iniciado por queixa na qual se descreve crime a que a lei comina pena máxima não superior a 2 (dois) anos, será adotado o procedimento",a) especial. | b)  ordinário. | c) sumaríssimo. | d) sumário. | e) extraordinário.,c,2009
"No procedimento do júri, depois de recebida a denúncia e concluída a instrução preliminar, o juiz proferirá sentença, na qual","a) pronunciando o réu, mandará o processo ao Ministério Público para oferecimento de libelo acusatório no prazo de cinco dias. | b) se estiver convencido da materialidade do fato e da existência de indícios de autoria ou de participação, fundamentadamente, pronunciará o acusado, reconhecendo a competência do júri. | c) manterá obrigatoriamente a prisão ou medida de liberdade anteriormente decretada. | d) não precisará declarar o dispositivo legal em que julgar incurso o acusado nem especificar as circunstâncias qualificadoras e as causas de aumento de pena, pois estas são de competência do Juiz Presidente do Júri e dos jurados. | e) não se convencendo da materialidade do fato ou da existência de indícios suficientes de autoria ou de participação, fundamentadamente, absolverá sumariamente o acusado.",b,2009
"Sobre as nulidades no processo penal, é correto afirmar que","a) nenhuma das partes poderá arguir nulidade a que tenha dado causa, mas se apenas concorreu para que ela se verificasse, pode alegar o vício desde que o faça no momento oportuno. | b) sendo o exame de corpo de delito indispensável nas infrações que deixam vestígios, a sua ausência é causa de nulidade nada podendo suprir-lhe a falta. | c) a falta de intervenção do Ministério Público na ação penal privada subsidiária da pública é causa de nulidade absoluta. | d) a falta de citação do réu é causa de nulidade, não a sanando o seu comparecimento ainda que declare que o faz apenas com o fim de arguir o vício. | e) as incompetências ratione personae e ratione materiae são absolutas e, por isso, podem ser ale- gadas a qualquer tempo, implicando nulidade do processo.",e,2009
Contra a sentença de impronúncia e de absolvição sumária caberá,"a) recurso em sentido estrito. | b) apelação. | c) apelação e recurso em sentido estrito, respectivamente. | d) recurso em sentido estrito e apelação, respectivamente. | e) recurso em sentido estrito ou correição parcial.",b,2009
O procedimento de instrução preliminar em caso de competência do Tribunal do Júri deverá ser concluído em até,a) cento e vinte dias. | b) trinta dias. | c) sessenta dias. | d) oitenta e um dias. | e) noventa dias.,e,2009
São condições da ação penal:,"a) Legitimação para agir, qualificação do acusado e prazo. | b) Que o fato narrado constitua crime, que a parte seja legítima e que esteja presente condição de procedibilidade. | c) Prazo, a forma e o destinatário. | d) Possibilidade jurídica do pedido, interesse de agir e legitimação para agir. | e) A descrição do fato criminoso em todas as circunstâncias, a classificação do crime e a qualificação do acusado.",d,2009
Sentença absolutória imprópria é a que,a) concede ao acusado a suspensão condicional da pena. | b) impõe ao acusado somente medida de segurança. | c) substitui a pena privativa da liberdade por multa. | d) substitui a pena privativa da liberdade por pena restritiva de direitos. | e) estabelece o regime prisional aberto para o cumprimento da pena privativa da liberdade.,b,2009
A decisão que admite a habilitação na ação penal pública incondicionada de assistente da acusação é,a) irrecorrível. | b) atacada por apelação. | c) atacada por recurso especial. | d) atacada por agravo em execução. | e) atacada por carta testemunhável.,a,2009
O recurso de apelação deve ser interposto:,a) somente por petição. b) por petição ou por termo nos autos. | c) por termo nos autos ou por agravo regimental. | d) mediante requerimento dirigido ao Ministério Público. | e) quando do oferecimento da defesa preliminar.,b,2009
Em conformidade com a lei processual penal são consideradas as seguintes espécies de prisão em flagrante,"a) forjado, presumido e especial. | b) preparado, putativo e próprio. | c) próprio, impróprio e presumido. | d) esperado, presumido e preparado. | e) próprio, forjado e presumido.",c,2009
"São atos da fase preliminar do procedimento previsto pela Lei nº 9.099/95, dentre outros:","a) termo circunstanciado, intimação das partes e oitiva de testemunhas. | b) termo circunstanciado, audiência preliminar e composição dos danos civis. | c) termo circunstanciado, citação do réu e instauração da ação penal. | d) inquérito policial ou termo circunstanciado, denúncia oral e tentativa de conciliação. | e) termo circunstanciado ou boletim de ocorrência, oitiva das partes e debates orais.",b,2009
"Em relação ao sistema de nulidades no processo penal, pode-se afirmar que a","a) falha na procuração para apresentação de queixa não poderá ser suprida. | b) falta de defesa constitui nulidade absoluta, mas a sua deficiência só anulará o processo se houver prova de prejuízo para o réu. | c) falta do exame de corpo de delito direto nos crimes que deixam vestígios causará nulidade absoluta, não se admitindo suprimento por qualquer outro meio de prova. | d) declaração de nulidade por vício na inquirição de uma testemunha sempre causará a dos atos de inquirição posteriores de outras testemunhas. | e) realização de citação por hora certa causará nulidade do processo, por não ser admitida.",b,2009
Contra a decisão que pronunciar e impronunciar o acusado,"a) caberão, respectivamente, apelação e agravo. | b) caberão, respectivamente, recurso em sentido estrito e apelação. | c) caberá recurso em sentido estrito, nos dois casos. | d) caberão, respectivamente, apelação e recurso em sentido estrito. | e) caberá apelação, nos dois casos.",b,2009
"Se o ofendido requerer a instauração de inquérito policial, em crime de ação penal","a) privada e a autoridade policial indeferir o requerimento, não caberá recurso algum no âmbito administrativo, podendo o ofendido todavia dirigir outro requerimento ao juiz de direito. | b) popular, a autoridade policial deverá exigir prova de que o requerente é cidadão. | c) pública incondicionada, a autoridade policial, necessariamente, deverá instaurar o inquérito policial, em virtude do princípio da oficialidade. | d) pública incondicionada que configura infração de menor potencial ofensivo, a autoridade policial poderá, por critério discricionário, instaurar inquérito policial ou elaborar termo circunstanciado. | e) pública condicionada, manifestando interesse em que o autor do crime seja processado, o requerimento poderá valer como representação.",e,2009
"Com o novo procedimento do júri,","a) na elaboração do questionário, o juiz presidente levará em conta tão-somente os termos da pronúncia ou das decisões posteriores que julgaram admissível a acusação e as alegações das partes. | b) foram suprimidos o libelo-crime acusatório e o protesto por novo júri, não havendo alteração quanto aos recursos cabíveis contra as decisões de pronúncia, absolvição sumária, impronúncia e desclassificação. | c) o desaforamento agora poderá ser determinado em razão do comprovado excesso de serviço se o julgamento não puder ser realizado no prazo de 1 (um)  ano, contado do trânsito em julgado da decisão de pronúncia. | d) o acusado poderá requerer ao Tribunal que determine a imediata realização do julgamento, desde que não haja excesso de serviço ou existência de processos aguardando julgamento em quantidade que ultrapasse a possibilidade de apreciação pelo Tribunal do Júri, nas reuniões periódicas previstas para o exercício. | e) o Tribunal do Júri é composto por 1 (um)  juiz togado, seu presidente e por 21 (vinte e um)  jurados.",d,2009
"Quanto à eficácia temporal, a lei processual penal","a) aplica-se somente aos fatos criminosos ocorridos após a sua vigência. | b) vigora desde logo, tendo sempre efeito retroativo. | c) tem aplicação imediata, sem prejuízo da validade dos atos já realizados. | d) tem aplicação imediata nos processos ainda não instruídos. | e) não terá aplicação imediata, salvo se para beneficiar o acusado.",c,2009
"Se o réu for condenado em processo de júri por dois crimes conexos, em um à pena de 21 (vinte e um) anos e em outro à pena de 18 (dezoito) anos, num total de 39 (trinta e nove) anos e interpuser apelação única em relação aos dois crimes, o juiz deve","a) admitir como protesto por novo júri o recurso em relação aos dois crimes, em virtude do total das penas e do princípio da fungibilidade. | b) receber a apelação em relação aos dois crimes como interposta. | c) não receber a apelação e não admitir o recurso como protesto por novo júri, porque houve erro grosseiro. | d) admitir como protesto por novo júri a apelação em relação ao primeiro crime em virtude do princípio da fungibilidade, e receber a apelação no tocante ao segundo. | e) não admitir recurso em relação ao primeiro porque cabia protesto por novo júri, havendo erro grosseiro, recebendo a apelação apenas quanto ao segundo.",b,2009
